body,title,url
"
El camu-camu, cuyo nombre científico es Myrciaria dubia, es un arbusto nativo del Amazonas, que también crece en algunas regiones de Colombia, Perú, Brasil, es considerado como un superalimento pues aporta una gran cantidad de nutrientes y minerales entre los que destaca su alto contenido en vitamina C, pues se estima que concentra hasta 30 veces más que otros alimentos.
El fruto del camu-camu es de color rojizo y de sabor un poco acido, aunque también suelen emplearse las hojas e incluso la corteza del arbusto con fines curativos.

LEER TAMBIÉN: Alimentos que te ayudan a combatir la retención de liquidos 
 



 


 

 



 




Ver esta publicación en Instagram


 



 

 

 



 

 



 

 

 



Una publicación compartida por INKA PRIME (@inka_prime) el 20 de Mar de 2020 a las 1:21 PDT



Este alimento  es rico en antioxidantes como los polifenoles y flavonoides que son capaces de retardar o prevenir la oxidación de otras moléculas, lo que ayuda a prevenir el envejecimiento prematuro y a prevenir algunos tipos de cáncer. Además, ayuda a prevenir enfermedades cardiacas, ya que contiene buenas cantidades de potasio, el cual es necesario para mejorar la hipertensión y ayuda a no retener líquidos. La serina, presente en el camú camú ayudará a mejorar la digestión pues es necesaria para el metabolismo de las grasas, además este aminoácido está relacionado con el mantenimiento de la hidratación de la piel.

LEER TAMBIÉN: Conoce todos los beneficios del brócoli 
 



 


 

 



 




Ver esta publicación en Instagram


 



 

 

 



 

 



 

 

 



Una publicación compartida por Eri Montero (@aromadelosandes) el 19 de Mar de 2020 a las 6:43 PDT



El camu-camu es un alimento que ayuda a aumentar los niveles de serotonina en el organismo, este fortalece la sensación de felicidad y bienestar, así como ayuda a normalizar los ciclos de sueño, por lo cual se considera un buen antidepresivo. La vitamina C presente en este fruto ayuda a reforzar el sistema inmunológico por lo que nos ayudara a prevenir enfermedades virales. Esta vitamina  también es esencial para la formación de colágeno, que le da elasticidad a la sangre. Por si fuera poco, este fruto protege al cerebro de enfermedades degenerativas como el Alzheimer pues ayuda a bloquear la acumulación de la plata del cerebro que causa este tipo de males.

LEER TAMBIÉN: Descubre que alimentos te ayudan a reforzar tu sistema inmune 

Si deseas conocer más noticas sobre el mundo de la gastronomía da clic aquí
 
",Descubre qué es y para qué sirve el camu-camu,http://www.eluniversal.com.mx/menu/que-es-el-camu-camu-propiedades-y-beneficios-para-la-salud
"
La pandemia de coronavirus ha extendido los sistemas de salud en todo el mundo hasta un punto de ruptura. Distintas firmas automotrices, así como varios equipos de Fórmula 1 cuentan con divisiones de tecnología aplicada como parte de sus operaciones y se encuentran buscando formas de ayudar al proceso de recuperación a nivel local.
El mayor productor de ventiladores médicos en Italia, Siare Engineering, convocó a marcas automotrices como Ferrari y Fiat Chrysler para ayudar a incrementar la fabricación de ventiladores médicos, que se necesitan urgentemente para combatir los casos de COVID-19 que azotan al país europeo.
Ante esta crisis, el gobierno italiano solicitó a Siare la incrementación en la producción de ventiladores médicos, pues antes fabricaban alrededor de 160 por mes, y ahora tendrán que hacer 500, mientras el total de muertos en el país ha sobrepasado los 3 mil 400.
Lee también: Tesla se compromete a fabricar ventiladores médicos para pacientes con COVID-19
“Nos encontramos en pláticas con Fiat Chrysler, Ferrari y Marelli para tratar de ver si pueden echarnos una mano en este proceso con la parte electrónica”, fueron las palabras de Gianluca Preziosa, jefe ejecutivo de Siare.
Preziosa añadió que la experiencia de las compañías automotrices en electrónica y neumática podría convertirlas en socios ideales, además de que resaltó el poder adquisitivo de las firmas, lo que los hace más propensos a obtener piezas que su pequeña empresa estaba luchando por asegurar, en medio de la interrupción provocada por la pandemia de COVID-19 en las cadenas de suministro mundiales.

Un vocero de Exor, compañia dueña de FCA y Ferrari, comentó que las reuniones con Siare tuvieron lugar el jueves, donde analizaron la viabilidad de la idea, por lo que se esperaba una decisión en las próximas horas. Se consideraron dos opciones: ayudar a Siare a diseñar un aumento de capacidad en su planta con el apoyo de técnicos proporcionados por FCA y Ferrari, o externalizar la producción de piezas de ventiladores médicos a las instalaciones de las marcas de autos.
Los fabricantes Ford y General Motors se encuentran haciendo planes con el gobierno de los Estados Unidos para unirse a esta causa. Por su parte, el primer ministro británico, Boris Johnson contactó a Ford, Honda y Rolls-Royce.
Otro de los empresarios que expresó su apoyo fue Elon Musk, jefe operativo de Tesla, quien respondió a una solicitud por parte de usuarios de la plataforma donde lo invitaron a unirse a la producción de ventiladores médicos, a lo que el CEO respondió que los fabricará “en caso de escasez.”
Por otra parte, la firma McLaren informó que se encuentra preparando un diseño para producir una versión simple de ventiladores médicos, y Nissan está trabajando con otras compañías para apoyar a los productores de ventiladores actuales.

La función de los ventiladores médicos es mover el aire dentro y fuera de los pulmones de los pacientes, por lo que podrían ser la diferencia entre la vida y la muerte de los enfermos de Coronavirus, que sufren dificultades para respirar.
Los equipos de la Fórmula 1 están explorando formas de ayudar a las autoridades gubernamentales y salud en la lucha contra el Coronavirus mediante el suministro de estos ventiladores.
",Así apoya la industria automotriz a combatir el Coronavirus,http://www.eluniversal.com.mx/autopistas/la-industria-automotriz-apoya-combatir-el-coronavirus
"

El mundo está paralizado. Los lugares que una vez estuvieron llenos del ajetreo y el bullicio propio de la vida cotidiana se han convertido en pueblos fantasma con restricciones masivas.

Han cerrado fábricas, colegios, se han impuesto restricciones a los viajes y se han prohibido reuniones tumultuosas.

La respuesta global a esta enfermedad no tiene precedentes.
Lee también: 5 estrategias que están funcionando en los países que han logrado contener los contagios de coronavirus 

¿Pero cuándo terminará y cuándo podremos seguir con nuestras vidas?

El primer ministro de Reino Unido, Boris Johnson, dijo que cree que el país puede ""cambiar el rumbo"" de la lucha contra el brote en las próximas 12 semanas y acabar con el coronavirus.

Pero incluso si el número de casos comienza a disminuir en los próximos tres meses, todavía estaremos lejos del final.

La tendencia puede tardar mucho tiempo en desaparecer, posiblemente años.

Está claro que la estrategia actual de autoaislamiento, que muchos países han puesto en marcha, no es sostenible a largo plazo porque el daño social y económico sería catastrófico.
Lee también: Coronavirus: ¿qué le hace el covid-19 a tu cuerpo?

Estrategias de salida

Lo que necesitan los países que ya han alcanzado el pico de la epidemia es tener claro cuál va a ser la ""estrategia de salida"", es decir, cómo van a levantar las restricciones y volver a la normalidad, pese a que el coronavirus no va a desaparecer.

Pero si levantan las restricciones que frenan el virus, entonces los casos inevitablemente se dispararán.

""Tenemos un gran problema en cuanto a cuál debe ser la estrategia de salida y cómo vamos a salir de esto"", dice Mark Woolhouse, profesor de epidemiología de enfermedades infecciosas en la Universidad de Edimburgo.

""No es solo Reino Unido. Ningún país tiene una estrategia de salida"".

Es un gran desafío científico y social. 

Básicamente, hay tres formas de salir de este lio.

Vacunación

Un número suficiente de personas desarrollan inmunidad tras contraer la infección

Cambiar permanentemente nuestro comportamiento como sociedad

Cada una de estas rutas reduciría la capacidad de propagación del virus.

Vacunas: se tarda al menos de 12 a 18 meses

Una vacuna debe dar inmunidad a alguien para que no se enferme si se expone al virus.

Si se vacuna a suficientes personas, en torno al 60% de la población, y el virus no es capaz de causar brotes, se alcanza lo que se conoce como el concepto de inmunidad colectiva.

Esta semana recibió una vacuna experimental en Estados Unidos la primera persona, después de que se permitiera a los investigadores saltarse el procedimiento habitual de realizar primero pruebas con animales.

La investigación de vacunas se está llevando a cabo a una velocidad sin precedentes, pero no hay garantía de que sea exitosa y requerirá inmunización a escala mundial.

La mejor suposición es que una vacuna podría estar lista en entre 12 y 18 meses si todo sale bien.

Ese periodo de tiempo es mucho si tenemos en cuenta las restricciones sociales adoptadas y que no tienen precedentes durante tiempo de paz.

""Esperar una vacuna no debe considerarse una estrategia. No lo es"", dijo el profesor Woolhouse a la BBC.

Inmunidad natural: faltan al menos dos años

La estrategia a corto plazo de Reino Unido y otros países es reducir los casos tanto como sea posible para evitar que los hospitales se vean desbordados.

Es cuando un sistema de salud se queda sin camas de cuidados intensivos cuando aumentan las muertes.

Una vez que la aparición de nuevos casos se ralentiza, se pueden levantar algunas medidas por un tiempo, hasta que los casos vuelvan a aumentar y se necesite otra ronda de restricciones.

Pero cuándo puede suceder todo esto es incierto.

""Tuve que abrir la iglesia del cementerio para alojar la gran cantidad de cadáveres"": entrevista con el alcalde de la ciudad de Italia más afectada por el coronavirus

El principal asesor científico de Reino Unido, Sir Patrick Vallance, dijo que ""no es posible establecer plazos absolutos en las cosas"".

Hacer esto podría, involuntariamente, conducir a la inmunidad colectiva, ya que es un proceso en el que cada vez más personas se infectan.

Pero podría llevar años conseguirla. 

Según el profesor Neil Ferguson del Imperial College de Londres: ""Estamos hablando de suprimir la transmisión a un nivel en el que, con suerte, solo una fracción muy pequeña del país se infectará"".

""Así que eventualmente, si continuamos haciendo esto durante más de dos años, tal vez una proporción suficiente del país en ese momento podría haber sido infectada para brindar algún grado de protección comunitaria"".

Pero hay dudas sobre si esta inmunidad durará.

Otros coronavirus, que causan síntomas de resfriado común, conducen a una respuesta inmune muy débil y las personas pueden contraer el mismo virus varias veces en su vida.

Alternativas: sin punto final claro

""La tercera opción son los cambios permanentes en nuestro comportamiento que nos permiten mantener bajas las tasas de transmisión"", dijo el profesor Woolhouse.

Qué son los coronavirus, cuántos hay y qué efectos tienen sobre los humanos

Esto podría incluir mantener algunas de las medidas que se han implementado. O introduciendo pruebas rigurosas y aislamiento de pacientes para tratar de estar al tanto de cualquier posible brote.

""Hicimos detección temprana y rastreo de contactos la primera vez y no funcionó"", agrega el profesor Woolhouse.

BBC

El desarrollo de medicamentos que puedan tratar con éxito una infección por Covid-19 también podría ayudar a las otras estrategias.

Podrían usarse tan pronto como las personas muestren síntomas en un proceso llamado ""control de transmisión"" para evitar que lo transmitan a otros.

O para tratar a pacientes en el hospital y hacer que la enfermedad sea menos mortal y reducir la presión de las plantas de cuidados intensivos.

Esto permitiría a los países hacer frente a más casos antes de tener que reintroducir medidas como la cuarentena.

Por qué covid-19 se llama así y cómo se nombran los virus y las enfermedades infecciosas

Aumentar el número de camas de cuidados intensivos también ayudará a hacer frente a brotes más grandes.

Le pregunté al consejero médico jefe del Reino Unido, el profesor Chris Whitty, cuál es la estrategia de salida.

Me dijo: ""A largo plazo, claramente la forma de salir de esto es una vacuna y todos esperamos que suceda lo más rápido posible"".

""A nivel mundial, la ciencia encontrará soluciones"".

BBC

MAPA: Alcance global del coronavirus

PREGUNTAS CLAVE: Cuáles son los síntomas y cómo se transmite

TRATAMIENTOS: Cómo están combatiendo el coronavirus 

PREVENCIÓN: Qué puedes hacer para evitar el contagio

Visita nuestra cobertura especial

Ahora puedes recibir notificaciones de BBC News Mundo. Descarga nuestra app y actívalas para no perderte nuestro mejor contenido.
",¿Cuándo terminará el brote de coronavirus y volverá todo a la normalidad?,http://www.eluniversal.com.mx/mundo/covid-19-cuando-terminara-el-brote-de-coronavirus-y-volvera-todo-la-normalidad
"
Ante la proliferación de información falsa sobre Covid-19, Beatriz Gutiérrez Müller, esposa del presidente Andrés Manuel López Obrador, pidió a la población no hacer caso a cadenas y mensajes que difunden información sin bases científicas y médicas sobre la pandemia y que lo único que hacen, acusó, es jugar con el miedo de las personas.
Por medio de un par de videos difundidos en sus cuenta de Twitter y Facebook, la también presidenta honoraria del Consejo Asesor de la Coordinación Nacional de Memoria Histórica y Cultural de México, pidió a la población informarse por medio de los informes que todos los días difunde el Gabinete de Salud del gobierno federal.
“¡Que bárbaro, todo lo que se escucha en estos días! Mensajecitos aquí por aquí y por allá (…) Cualquiera ahora toma su teléfono graba un mensaje diciendo que es muy allegado a una persona y que tiene información valiosa y que es poseedor de esos datos.
“Tú debes de consultar a las fuentes oficiales, que es la Secretaría de Salud (Ssa) la encargada de dar esta información, no estos individuos que, con intereses oscuros, no esclarecidos, toman un teléfono y dicen ser cercanos de no se quién y te venden la idea de que tu debes salir a ponerte una vacuna, de hacerte un estudio de laboratorio, compras de supermercado.
Lea también: Científicos investigan información falsa sobre el coronavirus
“No, el gobierno es muy responsable y te está dando información precisa, no omitida, hay seriedad. Cada esta cadenita, como esta, no la escuches, y no la creas (porque) están jugando con tu miedo, y lo que tienes que hacer es confiar en ti y en las autoridades que son las expertas, no estos fulanos que no dan su cara, que no dan su nombres y lo único que hacen es hacer correr rumores”.
En la videograbación, la escritora compartió el extracto de una de estos audios que circulan por WhatsApp y redes sociales, por lo que pidió a la población a tomar con seriedad el caso del coronavirus y escuchar todos los días, las conferencias de prensa que se transmiten desde Palacio Nacional “y no a estos fulanos que andan diciendo cosas para que tu tengas miedo”.
“No te dejes engañar por mensajes cuya fuente no puedes comprobar y sobre todo, no los disemines, porque lo que tú provocas al hacer esto, es hacer la bola de pánico más grande y cuando hay una sociedad llena de pánico, esa sociedad hace tonterías y también se moviliza.
“Te pido que pongas atención y que cheques tus noticias antes de distribuirlas. Los que saben son los científicos, no al primo del diputado, del alcalde. Ojo”, comentó.

Ojo con la información falsa. Falsos emisarios que no se identifiquen. No hagas caso a mensajes que no provienen de la fuente oficial. @HLGatell
 En la Ciudad de México los mensajes los brinda la doctora @Claudiashein pic.twitter.com/apB9JFm5qx
 — Beatriz Gutiérrez Müller (@BeatrizGMuller) March 20, 2020
rcr
",Gutiérrez Müller pide ignorar cadenas y mensajes sin bases científicas sobre Covid-19,http://www.eluniversal.com.mx/nacion/seguridad/gutierrez-muller-pide-ignorar-cadenas-y-mensajes-sin-bases-cientificas-sobre-covid
"
El Departamento de Trabajo de Estados Unidos explica que los riesgos de exposición laboral durante una pandemia pueden variar de muy alto a precautorio, según la proximidad de personas potencialmente infectadas. 

Pero incluso en los niveles de alerta más bajos, las empresas deben desarrollar planes para minimizar las infecciones de los empleados.

Una de ellas es, por supuesto, la limpieza y desinfección de los lugares de trabajo. Los Centros para el Control y Prevención de Enfermedades (CDC) dicen que esta medida forma parte de la primera línea de defensa, como lavarse frecuentemente las manos y taparse al estornudar. 


Working at a polling station? Help reduce the risk of exposure to respiratory diseases, like #COVID19, by routinely cleaning and disinfecting frequently touched surfaces & voting associated electronics. Learn more: https://t.co/ZjeKiqG5jG. pic.twitter.com/TVzP0ZisnH
— CDC (@CDCgov) March 10, 2020


Recomendamos 






Coronavirus. La imagen de una enfermera que se convirtió en símbolo de lucha en Italia


La imagen de Elena Pagliarini retrata la situación que se vive en los hospitales del norte del país, en donde enfermeras y médicos son considerados ""héroes"" 




La limpieza “no necesariamente mata los gérmenes, pero al eliminarlos, disminuye su número y el riesgo de propagar la infección”. La desinfección sí mata gérmenes porque se usan productos químicos. 

¿Cómo limpiar el lugar de trabajo?

Limpia y desinfecta a diario las superficies y objetos que se tocan con frecuencia. Esto incluye  escritorios, monitores, puertas, teclados de computadora, elementos de aprendizaje práctico, manijas de grifos, teléfonos.


Lava las superficies de escritorio con un jabón doméstico general para eliminar los gérmenes. 

Enjuaga con agua y usa un desinfectante registrado para matar los gérmenes. 

Verifica que el producto que usas sea eficaz contra el virus que desean eliminar.

La desinfección requiere que el producto repose en la superficie de 3 a 5 minutos.

Si las superficies u objetos están sucios con fluidos corporales o sangre, usa guantes.

Para los teléfonos, mouse y teclado puedes usar toallitas húmedas durante el día. 

Los CDC anotan que no son recomendables los procesos que incluyen fumigar o usar aerosoles, pues pueden irritar los ojos, la nariz, la garganta y la piel; agravar el asma; y causar efectos secundarios graves.


Para tomar en cuenta... 


No mezcles limpiadores y desinfectantes a menos que la etiqueta lo indique. 

Siempre que uses cloro ponte guantes. 

Coloca los desechos en basureros sin contacto. 

Evita usar los pañuelos usados. 

Lávate las manos si llegas a tocar pañuelos usados o basureros. 


¿Qué otras medidas recomiendan aplicarse en los centros de trabajo?

Proporcionar recursos que promuevan la higiene personal: poner al alcance pañuelos de papel, botes de basura sin contacto, jabón de manos, desinfectantes, toallas desechables, dispensador de jabón. 


Brindar capacitación sobre factores de riesgo. 

Minimizar contactos entre empleados. 

Desarrollar políticas que alienten a los empleados enfermos a quedarse en casa sin temor a represalias.

“Interrupción de viajes no esenciales a lugares con altas tasas de transmisión de enfermedades”. 

Dependiendo del nivel de alerta, pueden trabajar desde casa con herramientas como correo electrónico, sitios web y teleconferencias. 


Lee 






Coronavirus. ¿Quién puede entrar a Estados Unidos?


La suspensión de entrada a EU no afecta a los residentes legales del país ni a extranjeros cónyuges de residentes legales




",,https://www.viveusa.mx/bienestar/asi-debes-limpiar-tu-lugar-de-trabajo-durante-el-brote-de-coronavirus
"
Al menos 405 mexicanos que permanecían varados en Perú regresaron este fin de semana a México.
Los connacionales se encontraban varados en Cusco, Perú, y se vieron imposibilitados para salir del lugar, luego de que el gobierno peruano implementara medidas sanitarias ante la propagación del COVID-19, lo que llevó a cancelación de vuelos.
La Secretaría de Relaciones Exteriores (SRE) y el Instituto Nacional de Migración (INM) implementaron un operativo para la repatriación de los mexicanos. Se enviaron 3 aviones para repatriar a los connacionales quienes -por consideraciones logísticas- tuvieron que ser trasladados por vía terrestre desde Cusco a Arequipa, para abordar los vuelos charter. Unos 23 connacionales se quedaron hospedados en Arequipa y 26 viajaron a Lima, donde se sumaron a otros que aún esperan retorno.
“Nos encontramos negociando nuevos operativos con las autoridades peruanas, ante las restricciones que genera la pandemia”, indicó Relaciones Exteriores en un comunicado. Añadió que todo se llevó a cabo en coordinacion con el Ministerio de Relaciones Exteriores en Perú y la embajada de ese país en México.
“La travesía tuvo una duración de más de 30 horas y la ruta aérea incluyó la Ciudad de México-Panamá-Arequipa-Pisco-Panamá y de vuelta a la Ciudad de México. Participaron in situ funcionarios del INM, la Dirección General de Protección de Mexicanos en el Exterior y la Dirección General de América Latina y el Caribe”, agregó.
El Gobierno de México agradeció ampliamente al apoyo brindado por parte de las autoridades peruanas y reiteró su compromiso con la asistencia y protección consular para sus nacionales en situación de emergencia y vulnerabilidad en el exterior, por lo que continuará trabajando para auxiliar a connacionales afectados por las restricciones que varios países han implementado ante la contingencia de COVID-19.
MAOT
",Regresan más de 400 mexicanos varados en Perú por coronavirus,http://www.eluniversal.com.mx/nacion/sociedad/covid-19-regresan-mas-de-400-mexicanos-varados-en-peru
