body,title,url
"
Texto: Carlos Villasana y Rodrigo HidalgoFotos actuales: Gabriel Barajas/CortesíaDiseño web: Miguel Ángel Garnica
 Compara el antes y el después deslizando la barra central (clic aquí para ver más grande)
 


De 1975 a la fecha, muchas cosas han cambiado en los alrededores del Metro Viaducto. El tráfico en la Calzada de Tlalpan se ha multiplicado, el viejo cine Álamos dio paso a una tienda departamental, y las torres de un nuevo conjunto habitacional se levantan en el horizonte. Entre los vecinos del rumbo apenas queda el recuerdo de una tragedia que marcó la historia del transporte capitalino, y sin embargo, poco a poco ha desaparecido del imaginario colectivo.
 
El 20 de octubre de ese año, el tren número 10 del Metro se estrelló contra el 08, que se encontraba detenido en la estación, cobrando la vida de 31 personas, según el reporte oficial, y dejando más de setenta heridos. El accidente ocurrió poco después de las 9:30 de la mañana en el andén con dirección a Tasqueña, y fue ampliamente cubierto por los medios, que llevaron a sus portadas las crónicas e imágenes más estremecedoras; relatos de víctimas y supervivientes, de padres que perdieron a un hijo, de jornadas de oración, confusión y dudas sobre el futuro.
 
Entre los primeros testigos se encontraba el fotógrafo José Fonseca, quien asegura en entrevista que este hecho lo impactó como reportero. “Fue algo insólito, la gente no lo creía. Yo llegué cuando acababa de suceder, todavía estaban esperando las ambulancias y a los bomberos, y se veían cuerpos salidos por las ventanillas, muchos heridos, fue muy fuerte. No sé a qué velocidad sería, pero los vagones estaban como acordeón.”
Fotógrafo decano de EL UNIVERSAL Jesús Fonseca quien ha sido testigo de varios acontecimientos históricos, entre ellos la matanza en Tlatelolco en 1968 y el accidente del Metro en 1975. Foto: Mario Caballero. 
“Me quedé cerca de media hora, porque los policías no querían que nos acercáramos a tomar fotos. Yo trabajé mucho tiempo la fuente y tenía contacto con las redes de policía, delegaciones, gracias a eso logré algunas fotos que fueron publicadas, pero también hubo censura. Parece mentira, pero la jefatura controlaba a todos los reporteros, y se trató de impedir que eso se divulgara.”


La conmoción popular fue enorme, en una ciudad que apenas seis años antes había estrenado la primera línea de este sistema, inaugurando lo que entonces se anticipaba como una era de modernidad, rapidez y eficiencia, muy distinta del ajetreo diario en los camiones y taxis. En la edición del 21 de octubre se leía una sentencia contundente: “el orgulloso y flamante Metro de la Ciudad de México se bañó en sangre y sus estructuras quedaron convertidas en chatarra”.
 
Para Fonseca, la imagen más sobrecogedora fue la de “una persona que estaba prensada entre las ventanas, muerta, con más de medio cuerpo hacia afuera del tren”. Esta escena también fue recogida en notas periodísticas posteriores, donde se narra el desenlace: “en vista de que no se podía rescatar el cuerpo completo, le pusieron una sábana encima para que la gente no viera que, de jalón en jalón, lo despedazarían. La sábana se cayó al momento de los tirones, y todos presenciaron horrorizados tan terrible maniobra.”
 

El encabezado principal de ese día hacía referencia a una situación peculiar, que más tarde fue objeto de diversas conjeturas: varios pasajeros afirmaron que alguien había accionado la palanca de emergencia del tren 08 en repetidas ocasiones a lo largo del viaje. Según el testimonio de Mario Mejía, “cuando llegamos a la estación Viaducto volvió a sonar la alarma, sólo que entonces fue cuando sentimos el golpe. Todos salimos corriendo entre gritos de horror y llantos desesperados.” La trabajadora Marta Montes afirmó que dicho llamado de alerta se debió a que el brazo de un hombre había quedado atrapado entre las puertas, sufriendo una herida. “Luego ya no supe más, pues escuché un fuerte ruido y me caí al suelo.”


Momentos después del accidente, el regente de la ciudad, Octavio Sentíes, se presentó en el lugar para coordinar a los equipos de rescate e informar que, por instrucciones del presidente Luis Echeverría, se formaría una comisión especial para investigar las causas. Sentíes se refirió al incidente de las palancas, asegurando que “no había nada de cierto”, y ante las preguntas sobre un posible acto de sabotaje, señaló que “no existía ningún elemento de juicio para imputar a alguien el accidente. En cualquier forma, todos los sistemas están siendo revisados.”
 
Otra nota del mismo día recogió las declaraciones del conductor del tren 10, Carlos Fernández Sánchez: “todo era normal, las luces de los semáforos me indicaban que el camino estaba franco. Cuando el convoy iba subiendo la loma del Viaducto Miguel Alemán, me di cuenta de que había un convoy estacionado. Quise frenar, apliqué el control PC, pero no me obedeció. Era inminente el choque. Entonces me tiré por el lado izquierdo de la puerta y caí al suelo. Rodé por el andén, me lastimé los brazos y la cabeza, pero a pesar de ello, al darme cuenta del accidente, traté de rescatar a los pasajeros.”
 
Sin embargo, las investigaciones se cerraron rápidamente, y para el viernes 24, la conclusión descartó el sabotaje y las fallas técnicas, dejando toda la culpa a Fernández Sánchez. Se realizaron pruebas con un tren cargado de sacos de arena, simulando el peso de los pasajeros, para examinar los sistemas de seguridad, y el resultado fue determinante: “el encargado del PCC ordenó detenerse al conductor y éste hizo caso omiso de la orden, y posteriormente desobedeció otra señal de alto que pudo observar en el tablero de sus controles”.



En el 2008, al cumplirse 33 años de este suceso, EL UNIVERSAL publicó un artículo titulado “La tragedia olvidada”, donde se recuerda el final de la historia: “oficialmente la colisión se debió a un error del conductor, un hombre de extracción humilde, quien purgó una pena de entre nueve y diez años, primero en Lecumberri y luego en el Reclusorio Norte, y salió de ahí para borrar su rastro. Extraoficialmente, la defensa del inculpado y el sindicato del Metro denunciaron una serie de inconsistencias e irregularidades, pero fueron apabullados por el México de los años setenta.”
 
Una última mirada a lo ocurrido en octubre de 1975 se puede encontrar en el libro Muerte sobre ruedas, de José Pérez Chowell, que sufrió una censura generalizada y hoy es muy difícil de conseguir. En las páginas interiores aparece tachado el título original, Un ataúd color naranja, aunque los nombres de los capítulos que lo integran son igual de explícitos: “No vuelvo a subirme al Metro”, “Me desmayé ante tanta sangre”, “Ya no creo ni en la paz de los muertos”, entre otros, aludiendo también al incidente de las palancas de emergencia y al hombre con el brazo lesionado, y terminando con un epílogo llamado “Carlos Fernández, la mayor víctima”.


Esta obra es un compendio de entrevistas ficticias, desde una adolescente que descubre la vida secreta de su novio tras su muerte, hasta un clarividente que predijo la tragedia; todo tipo de personas con destinos marcados por el choque del Metro. En el fondo, la ironía y la crítica de Chowell dejan un mensaje muy claro al lector: “nada más piense que cuando nos dicen que no subirá el precio del pan, el pan sube; no subirá la leche, la leche sube; no subirá el azúcar, el azúcar sube. Entonces, ¿se nos avisó o no?, claro que sí: nunca se accidentará el Metro, y el Metro se accidenta.”
 
Las fotos recientes fueron tomadas en el ángulo de las antiguas para observar cómo lucen actualmente los sitios donde ocurrió aquella tragedia. Cortesía de Gabriel Barajas.
 Fotos antiguas: Archivo EL UNIVERSAL y la principal y la segunda comparativa son de la Colección Villasana/Torres.
 Fuentes: Hemeroteca EL UNIVERSAL; Entrevista con el fotógrafo de EL UNIVERSAL Jesús Fonseca.

 
",Cuando murieron 31 personas en el Metro,https://www.eluniversal.com.mx/mochilazo-en-el-tiempo/cuando-murieron-31-personas-en-el-metro
"



    googletag.cmd.push(function() {
      googletag.display(""dfp-ad-top3_content"");
    });
  


Ante la contingencia por coronavirus, una de las medidas es el aislamiento, por lo cual, muchos preguntan qué hacer en cuarentena para no aburrirse.
Quienes hacen home office tienen a su favor que tienen cosas que hacer, incluso a veces más que si estuvieran en la oficina. 
Sin embargo, no es el caso de todos, y cuando oyen la palabra “cuarentena” y no llevan ni 5 días, quieren aventarse del quinto piso.
La cuarentena es un término que se usa para referirse a un periodo de 40 días, pero también cuando se habla de aislamiento, como en este caso por la pandemia del coronavirus.
VER: Coronavirus: Cuándo empieza y cuánto dura la cuarentena en México
Si no es tu caso, y no sabes qué hacer para no aburrirte ahí van algunas recomendaciones.
Tips para no aburrirte en la cuarentena
Todo depende de tu estilo de vida, si vives solo o acompañado, si hay menores de edad, si trabajas en casa, si tienes mascotas e incluso el espacio donde vives.
No es lo mismo un departamento para ti sol@, que uno compartido donde sólo tienes tu recámara. Ni hablar de una casa. 
*Si trabajas, organiza tus horarios para que puedas darte el espacio para desayunar y comer.
*Puedes darte un espacio de relajación, como simplemente ver televisión.
*Si en tu rutina estaba el hacer ejercicio, no lo dejes de hacer. Compra artículos que te ayuden a tus rutinas, como mancuernas, pesas, tapetes. Un simple video de zumba puede ayudarte.
*Organiza reuniones vía redes sociales, charlas con amigos, como si salieran a tomar un café, pero cada quien en su casa.
*Muchos no saben o no quieren saber de quehaceres en casa, pero esta es la oportunidad de organizar papeles, documentos, escombrar, tirar cosas que no utilizas.
*Es momento incluso de remodelar, pintar tu casa, reacomodar espacios.
*Usa tu creatividad para hacer todo eso que no puedes porque no tienes tiempo, como cocinar, hacer repostería.
*Juega con tus mascotas si es que las tienes, sobre todo si casi no te ven.
*Netflix ofrece una gran cantidad de series, películas, telenovelas, programas, reality shows. Es momento de un maratón.
Consejos para la cuarentena por coronavirus si hay niños
Si eres de los que tendrán niños en casa, lo primero es acondicionarles un espacio de juegos y recreación, si es que no lo tienen aún.
Pues aunque para ellos será como tener vacaciones, para ti como adulto, no.
Organiza a ratos espacios donde jueguen, pero también que sirva para estimularlos a seguir aprendiendo cosas.
No los dejes viendo televisión todo el día o el celular, pues no es recomendable.
Es importante tener en cuenta medidas de seguridad, sobre todo si eres de los que harán home office y no lo hacen normalmente.
Lo anterior para evitar accidentes domésticos como quemaduras, caídas.
Tips de cuidados de niños en casa durante la cuarentena
TE PUEDE INTERESAR
Casos de coronavirus en Mexico por estado | Estadísticas Covid-19
¿Cómo hacer tu gel antibacterial casero para manos con alcohol?
Coronavirus: 15 datos que debes saber sobre la pandemia de Covid-19
Medidas preventivas por Coronavirus en Puebla
Eventos suspendidos en el Estado de México por Coronavirus
Odalys Ramírez tiene coronavirus, famosos con Covid-19
Cuántos casos hay de coronavirus en Yucatán
¿Cuántos casos de coronavirus hay en Jalisco? 
Coronavirus obliga a suspender desfile del 5 de mayo en Puebla
Casos de coronavirus en Puebla aumentan en las últimas horas
",Qué hacer en cuarentena para no aburrirse,http://www.unionyucatan.mx/articulo/2020/03/19/salud/que-hacer-en-cuarentena-para-no-aburrirse
"
Utilizar joyería mientras te bañas o te lavas las manos puede dificultar una adecuada higiene, en especial en este momento de emergencia sanitaria que es esencial para prevenir la propagación del coronavirus. 

Si bien el uso de jabón y el agua no combate el virus, sí es un método para eliminar los gérmenes que se encuentran alojados en las grietas de las manos y uñas, además reduce las posibilidades de contraer la enfermedad que está paralizando el mundo estos días. 

De acuerdo con un estudio hecho por la Universidad Estatal de Georgia en 2018, las personas que utilizaban joyería, específicamente anillos, tenían más probabilidades de alojar más bacterias en el área de “asentamiento” que las personas que se lavaban de forma adecuada, con agua, jabón y sin anillos. 

Lee 






Así es el lavado de manos que recomiendan las autoridades de EU


Un mal lavado de manos puede provocar la aparición y propagación de bacterias peligrosas para la salud 




Por su parte, el uso de geles antibacteriales o desinfectantes pierden su efecto si se utilizan con prendas de joyería puestas. 

En 2003, otro grupo de investigadores descubrió que las personas que utilizaban estos productos sin quitarse sus anillos generaban más bacterias en las manos que aquellas que no lo hacían, aún siguiendo un protocolo de higiene adecuado. 

Asimismo, las personas que se lavan las manos sin anillos, pero después se los vuelven a poner, obstaculizan la capacidad de los jabones o desinfectantes de matar los gérmenes, debido a que están contaminados. 

“Si los anillos están contaminados y te los vuelve a poner después de lavarte las manos, las ha vuelto a contaminar”, dice Lucy Wilson, profesora del departamento de servicios de salud de emergencia de la Universidad de Maryland. 

“Si no vas a desinfectar tus anillos, no deberías quitártelos y ponértelos de nuevo”, resalta. 

Visita 






Celebridades que han compartido la forma correcta de lavarse las manos


Estas celebridades han compartido divertidos videos para instar a las personas a mantener sus manos limpias y a cuidarse durante la pandemia por Covid-19





Cómo lavarse las manos de forma correcta 

De acuerdo con el Departamento de Agricultura de Estados Unidos y Seguridad e Inspección Alimentaria (USDA Food Safety en inglés), un correcto lavado de manos debe tener los siguientes pasos:


Mójate las manos con agua limpia y corriente. 

 Enjabona las manos frotándolas entre sí, asegúrate de enjabonar el dorso de las manos, entre dedos y bajo las uñas. 

 Frota por al menos 20 segundos. 

 Enjuaga bien las manos con agua corriente limpia. 

 Sécate bien las manos con una toalla limpia o déjalas secar al aire.


Por su parte, los Centros para el Control y Prevención de Enfermedades (CDC por sus siglas en inglés) señalan que la mejor manera de usar el desinfectante es aplicarlo sobre las manos, frotarlo sobre la palma, el dorso, entre los dedos y bajo las uñas hasta que estén secas. 

 

No te pierdas de las últimas noticias de Vive Usa en Google News,  síguenos aquí

Gráfico. Mitos sobre el coronavirus desmentidos por la OMS



",,https://www.viveusa.mx/bienestar/por-que-no-deberias-usar-joyeria-mientras-te-lavas-las-manos
"
Ha quedado claro que ni perros, ni gatos, transmiten el coronavirus, como en algún momento se rumoró, pero lo que sí generan son muchas horas de diversión a través del cine.
EL UNIVERSAL te presenta algunas de las producciones que han utilizado a los animales domésticos para contar historias de amor y ternura, aunque a veces, de terror.
SIEMPRE A TU LADO
Inspirada en el caso real de Hachiko,un perro que esperó por años, frente a una estación de tren, a su amo fallecido. Richard Gere fue el protagonista de 2009, que para muchos termina con una gran lágrima.

EL GATO QUE VINO DEL ESPACIO
Si, a fines de los 70's, Hollywood decidió colocar a un minino como ser galáctico, que podía hablar con los humanos y portaba un collar que se iluminaba y hacía pasar diversas amarguras a los villanos de la historia.

MARLEY Y YO
Jennifer Aniston y Owen Wilson deciden adoptar a pequeño cachorro que conforme va creciendo come zapatos o destruye todo a su alrededor, aunque también se convierte en fiel cuidador de sus hijos.

MÁS NEGRO QUE LA NOCHE
Carlos Enrique Taboada imaginó a un gato vengativo, luego de haber sido asesinado por un grupo de amigas. La primera versión se dio con Lucía Méndez y Susana Dosamantes en 1975, pasando casi 40 años para que Zuria Vega y Adriana Louvier, protagonizaran la suya y en 3D estereoscópica.

LA RAZÓN DE ESTAR CONTIGO
¿Cuál es la razón de vida de un perro? Conocer a un humano, crecer, hacer travesuras y morir. Pero su alma viajará por los tiempos, con distintos amigos humanos, y un día se reencontrará con ese niño, ahora adulto, que lo cuidó.

UN GATO CALLEJERO LLAMADO BOB
Basada en el best seller homónimo, cuenta la historia real del escritor que supera sus adicciones gracias a la compañía de un gato, quien le enseña la importancia de la vida.

LA DAMA Y EL VAGABUNDO y LOS ARISTOGATOS
Ambas apuestas de los estudios Disney, cuando la animación 2D reinaba en todo el mundo, aunque de una de ella se hizo reversión reciente. En una, una perrita de clase alta era enomarada por un perro callejero y, en la otra, los gatos hasta grupo musical tienen. Un minino contó con la voz de Germán Valdés ""Tin Tán"".


-----------------


FRITZ DE CAT
Comedia para adultos de 1972, dirigido  por Ralph Bakshi. Basada en una tira cómica, tiene alto contenido social, siendo ambientada en la década de los 60's.


rad 
 
",Películas de perros y gatos que alegrarán tu cuarentena ,http://www.eluniversal.com.mx/espectaculos/cine/coronavirus-peliculas-de-perros-y-gatos-que-alegraran-tu-cuarentena
"
En medio de la paranoia colectiva que se ha desatado a raíz del aumento de infectados y muertes por coronavirus en Estados Unidos, así como de las estrictas normas de aislamiento social, autoridades de California dicen que los residentes han estado llamando al 911 para reportar que sus vecinos tienen tos y podrían estar infectados. 

De acuerdo con informes de medios locales, las llamadas al 911 están en aumento en los condados de Riverside y San Bernardino a medida de que los casos de Covid-19 crecen en el estado cada día. 

La policía de Palm Springs registró cinco llamadas continuas durante la semana de residentes que creen que sus vecinos están contagiados luego de escucharlos toser o estornudar con fuerza. 

Lee 






Usuarios de Amazon desatan pánico por mascarillas fabricadas en Wuhan, China 


Los clientes que compraron paquetes de mascarillas faciales en línea descubrieron que fueron hechas en Wuhan, China, lugar donde se originó el COVID-19 




Por su parte, el comandante Paul Herrera, del Departamento de Policía de Cathedral City, informó a The Desert Sun que suelen recibir llamados similares. 

Ante estas llamadas de pánico, los despachadores de cada departamento tienen la indicación de preguntar a las personas que llaman si sus vecinos han viajado al extranjero recientemente o si saben si han estado en contacto con alguien diagnosticado o con síntomas. 

También se les ha indicado llevar la situación con la mayor seriedad posible y con las medidas de precaución impuestas por los especialistas de salud para prevenir contagios entre los primeros ‘respondedores’ y la propagación con otros compañeros. 

Los paramédicos son enviados a las direcciones indicadas por los ciudadanos para proporcionar la atención médica necesaria antes de transportar a las personas a un hospital, dice The Desert Sun. 

“Si eso sucede, nos preocupamos por las llamadas de servicio”, dijo Neil Gallucci, jefe del Departamento de Policía de Carlsbad. “Estamos preparados para enfrentar los problemas que surjan, pero es una preocupación ed la que se preocupan los jefes”. 

Hasta el 19 de marzo, California es catalogado como el tercer estado más afectado con 18 muertes y 906 casos confirmados, según anuncia el Departamento de Salud Pública de California. 

Visita 






Policía pide no llamar al 911 por escasez de papel higiénico 


Las autoridades de Oregon piden no catalogar la escasez de papel de baño como una emergencia 




 

No te pierdas de las últimas noticias de Vive Usa en Google News,  síguenos aquí

Gráfico. Mitos sobre el coronavirus desmentidos por la OMS



",,https://www.viveusa.mx/noticias/californianos-entran-en-panico-por-vecinos-con-tos-los-reportan-al-911
"
La naturaleza nos dota de paisajes maravillosos que muchas veces son olvidados por las obras de los humanos, no obstante, la belleza y magnitud de los primeros es algo incomparable. Un ejemplo de esto lo podemos observar en los bosques, mismo que además de ser valiosos para el medio ambiente nos proporcionan diversos recursos.
De hecho, de acuerdo con la Organización de las Naciones Unidas para la Alimentación y la Agricultura (FAO) un bosque brinda agua y aire limpios, además de suelos saludables. 
El día de hoy se celebra el Día Internacional de los Bosques, por lo que aquí te traemos una lista de algunos de los más espectaculares del mundo.
Leer también: El bosque de bambú que derrocha belleza 


Bosque de bambú en Japón
En Kioto, a los pies del monte Arashimaya se encuentra, un espectáculo visual y auditivo sin precedentes. Aquí crecen alrededor de 50 variedades de bambú que se elevan hasta los 20 metros de altura y de acuerdo con la agencia de viajes especializada en destinos como Japón y Extremo Oriente, Kublai Tours, cuando el aire se cuela entre los enormes tallos de bambú que conforman este bosque, se recoge el sonido del viento en una especie de sinfonía natural irresistible para los habitantes y visitantes de esta gran ciudad.
 (Foto: Pixabay)

Bosque de piedra en China
La agencia de viajes Viaje China Experto, estipula que El Bosque de Piedra o Shilin es uno de los principales destinos turísticos de la provincia de Yunnan. Su nombre proviene de su apariencia ya que está compuesto por una gran extensión de formaciones calizas color gris que remiten justamente a un bosque de piedra. Según la agencia mencionada, en la zona abierta al público “se han hecho senderos, estrechos pasadizos y escaleras que se extienden como un laberinto entre montes y pináculos dando al paisaje un aire irreal”.

Leer también: El bosque más embrujado del mundo 

Bosque hundido en la Patagonia
De acuerdo con la doctora en ciencias biológicas, Mailén Elizabeth Lallement, debido al sismo del 22 de mayo de 1960, con epicentro en territorio chileno, una porción de la ladera del cerro Bayo se desplazó junto con los árboles y rocas dentro del lago, dando origen a lo que se conoce como el bosque hundido del lago Traful, lugar donde se pueden encontrar árboles de hasta 30 metros de altura, los cuales permanecen sumergidos y asombrosamente de pie con sus raíces en el fondo y algunas copas asomándose en la superficie del lago, originando un escenario único.
 (Foto: Welcome Argentina)

Parque Nacional de los lagos de Plitvice 
De acuerdo con el sitio web de información turística sobre la República de Croacia, llamado La Croacia, Plitvice es un entorno forestal que podría ser conocido como “el Paraíso de los Agua, ya que cuenta con 16 pequeños lagos, además de múltiples cascadas y arroyos”. Según un documento publicado por la UNESCO, este paradisiaco lugar localizado en la zona kárstica de los Alpes dináricos, es famoso por la increíble belleza de su cadena de 16 lagos interconectados color verde esmeralda, con barreras travertinas cubiertas por vegetación exuberante.
 (Foto: La Croacia)
Leer también: Encuentran el bosque fosilizado más antiguo del mundo en área abandonada de Nueva York 

Bosque de Savernake
Este bosque se sitúa en el condado de Wiltshire (Inglaterra) y de acuerdo con el sitio web de protección forestal, Forestry England, es un lugar especial de interés científico y un importante legado histórico. Además, en primavera se le puede ver cubierto por una capa de pétalos violetas que caen de algunas de las flores de sus exóticos árboles. Según el sitio web mencionado, su historia ha dejado un legado sobresaliente de árboles viejos, paisajes ricos y hábitats diversos, cuestión que lo vuelve un bosque ideal para pasar un día divertido y educativo.
 (Foto: Britain Express)
Sea cual sea la naturaleza de los bosques, su importancia es vital para la humanidad, no de en balde, hoy 21 de marzo, se rinde un homenaje a la importancia de todos y cada uno de los tipos de bosques, intentado generar de esta manera conciencia al respecto, según afirma la ONU.
",5 bosques espectaculares del mundo,http://www.eluniversal.com.mx/destinos/cuales-son-los-bosques-mas-espectaculares-del-mundo
