body,title,url
"
Texto: Yessica Torres
Al visitar la Ciudad de México es casi obligatorio caminar por los largos caminos de la Alameda Central. Conforme se avanza y aprecia la monumentalidad de la metrópoli, es inevitable no toparse con el Hemiciclo a Juárez, un monumento histórico conmemorativo mandado a construir en 1910 por Porfirio Díaz. 
Su construcción inició en el mes de agosto y terminó el 16 de septiembre, pero se inauguró dos días después, el 18 septiembre de 1910, este 2020 cumple 110 años. 
Este hemiciclo fue a semejanza del teatro griego antiguo: en semicírculo y con asientos colocados en filas escalonadas. Los hemiciclos tenían la función de que quien estuviera al centro, al dar su discurso, sería escuchado por todo el público, el centro de atención.
La intención de Díaz fue también dar discursos en este lugar, de ahí su forma monumental, que a su vez significaba el respeto y amistad que llegaron a tener él y Juárez a pesar de las diferencias políticas, además de que Juárez fue maestro de Díaz en Oaxaca y ambos fueron presidentes. Díaz debía demostrar también que su gobierno gozaba de una situación económica estable construyendo grandes obras como esta. 
El hemiciclo a Juárez no sólo embellece la ciudad, sino que también tiene y hace su propia Historia. Se convierte en un testigo mudo de la cotidianidad, no está a favor ni en contra y más allá de poseer un valor artístico, histórico o arqueológico, permite mantener viva la memoria histórica de la nación.
Imagen de 1968 al fondo la Unidad Habitacional Tlatelolco. Archivo/EL UNIVERSAL.
Se edificó en memoria de Pablo Benito Juárez García, pastor que llegó a ser presidente del México independiente durante el siglo XIX a pesar de vivir en un contexto de inestabilidad política, económica, social, cultural y de resistir en varias ocasiones las intervenciones extranjeras y de quien conmemoramos su natalicio un día como hoy pero ya hace 214 años. 
Hoy recordamos que Juárez sigue presente, ya sea en la lectura que hacemos de los libros de historia, al leer o escuchar las efemérides o cuando nos detenemos a apreciar el Hemiciclo, pero ¿qué nos puede contar un monumento de la historia de la capital, quién lo hizo, por qué, cuándo, qué significa cada elemento que lo compone?

No fue Díaz el primero en proponerlo

De acuerdo con Silvia Díaz en Juárez: la construcción del mito, el presidente Díaz no fue el primero. Fue a partir de un decreto emitido por el congreso el 18 de abril de 1873, en el que se declaraba a Juárez Benemérito de la Patria en grado heroico.
Desde entonces se establecía que cada 21 de marzo la bandera se colocaría en edificios públicos conmemorando el nacimiento de aquel oaxaqueño y que cada 18 de julio luciría a media asta en señal de duelo por su muerte.
También se planteó la creación de dos monumentos, uno conmemorativo y otro sepulcral.
El decreto solo quedó plasmado en las hojas porque después de 37 años, el presidente Díaz concretaría el proyecto propuesto en el congreso. A pesar de que en algún momento él  se rebeló contra Juárez.
 

Díaz y Juárez

El Benemérito de las Américas durante su estancia en la silla presidencial tuvo roces con otros personajes emblemáticos de la historia de México como José de la Cruz Porfirio Díaz Morí, quien proclamó el Plan de la Noria, con el lema “no reelección” contra Juárez, el cual fracasó.
Díaz ocupó la presidencia por más de tres décadas, bajo el lema “orden y progreso”. Buscaba cimentar las bases de una identidad nacional y demostrar que México había entrado a la modernidad a través de construcciones, mejorando la industria, el comercio y las vías de comunicación.
En 1910 se festejaron cien años de la independencia, 104 años del natalicio de Benito Juárez, 80 años de Porfirio, el inicio de la Revolución Mexicana y la apertura a “la democracia”, se buscaba forjar un sentimiento nacionalista realizando culto a los héroes patrios y obras como la Columna de la Independencia, hospital de la Castañeda, parque Balbuena, entre otros.
 

Compara el antes y después deslizando la barra central
(clic aquí para ver más grande)

 

¿Qué había en la alameda antes del Hemiciclo?

Antes, en el lugar donde hoy vemos el Hemiciclo se encontraba el Kiosko Morisco construido en 1884 por el ingeniero José Ramón Ibarrola para representar a México en una exposición en Nueva Orleans, después regresó al país y se colocó en la Alameda Central.
En los tiempos de Díaz y a raíz de los festejos del Centenario de Independencia, el kiosko se trasladó a la colonia Santa María la Ribera. Después, en su lugar, se construyó el Hemiciclo.
El Kiosko Morisco cuando aún estaba en la Alameda Central. Foto: Colección Villasana/Torres. 

También lee: Santa María la Ribera ayer y hoy 

La inauguración de más de mil toneladas de mármol

Según el periódico El Imparcial, a las diez de la mañana se iba a realizar la ceremonia de inauguración. A ella asistiría el presidente de la República con su gabinete, la banda de los policías cubriría los números musicales, Luis G. Urbina declamaría su poesía, la entonación del Himno Nacional y el batallón haría una guardia de 40 hombres con bandera.
En la ceremonia, el presidente deslizó una bandera que cubría la leyenda: “Al Benemérito Benito Juárez. La patria” y expresó unas palabras: “Hoy 18 de septiembre de 1910. Declaro solemnemente inaugurado el monumento que la República, agradecida, ha levantado a la memoria del gran Reformador Benito Juárez”.
Inauguración del Hemiciclo a Juárez el 18 de septiembre de 1910. Al frente el general Porfirio Díaz en el marco del Centenario de la Independencia. Foto: Archivo EL UNIVERSAL.
También se presentó un informe del ingeniero don Ignacio de la Barra, quien dio una lista de los gastos. Afirmó que la obra era una inspiración del artista Heredia, ejecutada por el escultor Lazaroni, en un block de Carrara de siete metros de altura y de 70 toneladas de peso, realizada en un plazo de 75 días. A próximamente dos meses y medio. 
Conforme avanzaba la lectura del documento, el ingeniero Barra precisaba que el trabajo se había suspendido durante varios meses porque no se recibían con regularidad las remisiones hechas en Italia, provocando que se montaran mil 346 bloques, de los mil 620 que formaban la construcción.
El mármol empleado alcanzaba un peso aproximado de mil 400 toneladas y un volumen de aproximadamente 600 metros cúbicos. Cada columna pesa diez toneladas, los arquitrabes ocho toneladas, los leones que están en el pie de la tribuna nueve toneladas y el conjunto escultórico pesa alrededor de 70 toneladas.
El discurso del ingeniero se leyó en presencia de los embajadores de Estados Unidos, Argentina, Guatemala  y España. No sin antes mencionar que se tenía la idea de realizar  la obra en la plaza de Santo Domingo, pero no se concretó nada.
 
Después de la construcción, el Hemiciclo registró un hundimiento que provocó el encharcamiento de basura y el deterioro del mármol blanco, debido a la rapidez con la que construyó la obra. 

Esculturas que componen el Hemiciclo a Juárez

De acuerdo con el texto Muerte y vida eterna de Benito Juárez de María del Carmen Vázquez, el monumento adquiere una función contemplativa y de propaganda política del gobierno que lo financia. La autora también describe el significado de cada símbolo de la obra.
Explica que la escultura de Juárez lleva en su mano derecha la Constitución de 1857, detrás de él, a su derecha se encuentra “La Gloria”, quien aparentemente está a punto de ponerle sobre las sienes una dorada corona de ramas de laurel y del lado izquierdo una “República”, la cual sostiene en su mano una espada y con la izquierda porta una antorcha que, según los investigadores, significa el “progreso”.
Imagen del Hemiciclo a Juárez donde se aprecian las tres esculturas: Benito Juárez en medio, a su derecha “La Gloria” y a la izquierda la “República”. Archivo/EL UNIVERSAL.
También se distinguen dos leones de mármol blanco, uno mirando al oriente y el otro al occidente, sostienen el cuerpo central de Juárez, la República y la Gloria. Al león se considera el rey de los animales, con carácter superior, virtud guerrera y además es el prototipo de una persona heroica.
Aparece una esfinge en tres columnas, una mirando al oriente, otra al occidente y la última se localiza en la entrada del semicírculo. También se encuentra el águila en tres ocasiones, ambas mirando al oriente, dos labradas en bronce, que en la masonería simboliza la audacia, investigación y fija la deslumbrante luz de la verdad.
El cetro es símbolo de poder y el ara es el corazón de la logia. El laurel significa la gloria, el triunfo y el roble la recompensa al valor, de acuerdo a la masonería.
La espada que también aparece en diversas ocasiones representa la separación entre el bien y el mal. En las ceremonias masónicas el honor, la conciencia y la protección. La antorcha encendida es la purificación por el fuego, figura como emblema de la verdad e ilumina los caminos de la iniciación.
Dos escudos que también podrían ser delantales, hacen alusión a la prenda que entre los masones simboliza el trabajo y que es la insignia de la jerarquía tradicional entre aprendices, compañeros y maestros y la prosperidad por sus dos cuernos de abundancia.
También lee: Benito Juárez, el masón más recordado

Testigo de los años

Este lugar, ha recibido al presidente en turno cada 21 de marzo, en una ceremonia cívica para rendirle homenaje al Benemérito. Excepto el presidente Miguel de la Madrid, quien le rindió honor en Oaxaca.
Durante el sexenio del presidente Carlos Salinas de Gortari fue Manuel Camacho, jefe del  Departamento del Distrito Federal, quien presidió la ceremonia, mientras el primer mandatario lo hacía en provincia.
Ernesto Zedillo lo conmemoraba en Palacio Nacional. En el año de 2020 por la situación de pandemia que vive el país, el presidente Andrés Manuel López Obrador anunció en la conferencia matutina que el homenaje a Juárez se hará en Guelatao, Oaxaca, y no en el Hemiciclo.
Una mujer policía de1968 ayuda a cruzar a un niño la avenida Juárez, al fondo el Hemiciclo. Foto: Archivo EL UNIVERSAL.
En esta construcción también se escribe la historia de los movimientos sociales, ya que ha sido punto de encuentro para la realización de motines y marchas por diferentes causas sociales, entre ellas las manifestaciones como la del Día Internacional de la Eliminación de la Violencia contra la Mujer y temas relacionados a las cuestiones de violencia de género.
El Hemiciclo a Juárez es sede de manifestaciones sociales y culturales rumbo al zócalo capitalino.
Presenció la llegada de simpatizantes del cantante Kalimba que exigían su libertad. También fue punto de reunión en 2006 del movimiento por la paz en Irak, entre muchas otras manifestaciones sociales y culturales a lo largo de varias décadas.
Ser un testigo mudo le ha costado daños a su cantera de carrara, ya que en dos ocasiones las águilas han sido decapitadas, la primera en 2003 y la última en febrero de 2020.
Restauración del Águila del Hemiciclo en 2003. Archivo/EL UNIVERSAL.
La fotografía principal es una imagen de 1964 en la que se aprecia al entonces presidente francés Charles de Gaulle junto al mandatario mexicano Adolfo López Mateos, ambos sobre un coche descubierto durante su paso por el Hemiciclo a Juárez y en medio de la expectativa de algunos citadinos. 
La imagen comparativa actual es de las Mujeres del Movimiento por Nuestros Desaparecidos en México y la Caravana de Madres Centroamericanas de Migrantes Desaparecidos, quienes participaron en noviembre del 2016 en un encuentro en el monumento del Hemiciclo a Juárez de la capital con el fin de visibilizar los esfuerzos que ambos colectivos. Archivo EL UNIVERSAL.
Diseño web: Miguel Ángel Garnica

Fuentes:

Díaz, Silvia, Juárez: la construcción del mito, México, UNAM, 2008.

Vázquez María del Carmen, Muerte y vida eterna de Benito Juárez. El deceso, sus rituales y su memoria, México, UNAM, 2006.

Periódico el Imparcial, Lunes 19,  de septiembre de 1910.

Diccionario de Masonería

Catálogo Nacional de Monumentos Históricos Inmuebles

Informe del Diputado e  Ingeniero Don Ignacio L. de la Barra

Archivo El Universal

 
",El hemiciclo donde Porfirio Díaz quería dar discursos ,https://www.eluniversal.com.mx/opinion/mochilazo-en-el-tiempo/el-hemiciclo-juarez-cumplira-110-anos
"

Por: Cristina Hernández
Fotos: Cortersía

Romina Casillas tenía cinco años cuando sus papás la inscribieron a un curso de verano en la Liga Maya de la MLB, junto con su hermano Leonardo. Ese fue su primer acercamiento al beisbol, y desde esa ocasión en la que vio jugar a su hermano mayor, le gustó tanto que quiso también participar en este deporte.

Ahora Romina tiene 11 años y entrena todos los días para conseguir una beca universitaria y practicar beisbol de manera profesional. Juega como cátcher y short stop, esta es la posición que le gusta más porque es en la cual juega cuando va a distintos torneos.
 

Han sido al menos ocho en los que ha participado, algunos en la Ciudad de México; Hermosillo, Sonora; Nuevo Laredo y Tampico, Tamaulipas; Ciudad Juárez, Chihuahua; Poza Rica, Veracruz; y Mazatlán, Sinaloa.
 “Lo que más me gusta del beisbol es que he adquirido experiencias y que puedo conocer más estrategias. Además es un juego en el que puedo convivir con mis amigos, batear y cachar la bola”, cuenta Romina en entrevista con EL UNIVERSAL.

Juega tanto beisbol como softbol; a pesar de la similitud entre éstos, tienen ciertas diferencias.

En el softbol las competencias están divididas en siete turnos y las anotaciones son válidas cuando un jugador cruza la placa antes de que el equipo contrario tenga tres salidas.

La Federación Internacional de Softball organiza los campeonatos para elegir los títulos mundiales, cada cuatro años. En México está la Selección Femenil de Beisbol que participará en los Juegos Olímpicos de Tokio 2020.

Después de su popularidad en Estados Unidos, llegó a países como España, México y Venezuela, donde se formaron las respectivas federaciones.

El campo de juego de softbol es más pequeño, también la bola es más grande y ligera que en el beisbol.

En él también participan mujeres, por eso se le atribuye que es un poco más especializado para ellas. En el caso del beisbol participan nueve personas, y no sólo se basa en técnicas, sino que también requiere de agilidad mental.

El objetivo del juego es pegarle a la pelota con un bate, para que el bateador corra a través del campo pasando por cuatro bases. En tanto, el equipo contrario debe impedir que el bateador complete una carrera.

El cátcher es quien comanda la defensiva del equipo, es el encargado de mandar las señales al pitcher para hacer los lanzamientos precisos. Además debe tener una gran agilidad mental y fuerza en el brazo.

En esta posición juega Romina. Desde sus primeros entrenamientos, su mamá Karla Moreno es quien la ha acompañado y motivado.

En Tampico, ganó el premio como la mejor bateadora en 2019.

“Mi mejor recuerdo fue cuando agarré una bola que iba muy lejos y me tuve que aventar y lo saqué en primera”, comenta Romina.

Este reconocimiento la tomó por sorpresa, pues no esperaba que le dieran el galardón. “Me sentí muy emocionada cuando escuché mi nombre”, expone Romina.

Mantener la disciplina

Los días de Romina se dividen entre estudiar el quinto año de primaria, las tardes de entrenamientos y los juegos en fin de semana. Sale de la escuela a las dos de la tarde y llega al campo de beisbol a las tres.

Después de la jornada deportiva, al estar en su casa cumple con sus tareas escolares. “Mis amigos dicen que a ellos les daría flojera entrenar todos los días, señala Romina. Sin embargo, ella ha mantenido la disciplina porque disfruta dedicar su tiempo a este deporte.

Hace dos años, la jugadora de softbol Stefanía Aradillas, quien participará en los Juegos Olímpicos de Tokio 2020, llegó a la Liga Maya. Ella contó a los niños y niñas cómo es que había llegado a representar a su país.

El ejemplo más claro fue que consiguió una beca deportiva para estudiar en la Universidad Estatal de San Diego. Estuvo ahí durante cuatro años y tuvo no sólo una carrera, sino también la oportunidad de practicar deporte de manera profesional.

Esta experiencia marcó a Romina, quien le dijo a su mamá: “Yo quiero estudiar ahí”. Desde entonces ha tenido muy claro que ese es su objetivo.

“Yo le digo que no es tan fácil como piensa, que está bien que quiera lograrlo, pero se debe trabajar mucho y mantener la disciplina”, dice su madre.

En este caso, Stefanía comentó que ella entrenaba todos los días y debía mantener un buen promedio.

Las universidades empiezan a observar a niñas desde los 12 o 13 años para ofrecerles las becas. Por eso, Romina está en la edad idónea para seguir esforzándose y demostrar su talento.
 Su pasión por el beisbol inició cuando tenía cinco años.
 Un juego de hombres

“Soy la única niña que juega como cátcher en este campo y también en los partidos”, dice Romina, quien en los torneos ha estado en equipos integrados sólo por varones. Asegura que le gusta más jugar con las niñas porque la entienden mejor al momento de hablar y jugar con ellas.

“La diferencia más grande es que puedo convivir mejor con ellas al momento del juego y me ayudan a ver lo que hice durante. Los niños sólo platican conmigo, pero casi no me ayudan”, añade.

Sin embargo, también ha enfrentado algunas diferencias por este motivo. La madre de Romina cuenta que en un torneo jugado en la Ciudad de México, su hija era la única niña que iba en el selectivo. El equipo contrario dijo que iba a ser un “cuadro chico” porque es niña.
 

Esto significa que todos se tenían que hacer hacia adelante porque iba a batear quedito, entonces recogerían la bola y la sacarían en primera base. Todos se hicieron hacia adelante porque les dijeron que venía una niña y a la hora del bateo, Romina lanzó la bola hasta la barda. “Yo me sentí pavorreal”, cuenta su madre, porque ya ninguno de los jugadores dijo nada.

En otra ocasión, Romina se quejó de un entrenador que les dijo “Este es un deporte de hombres”. Al salir, le contó a su madre. “Le dije que no era personal hacia ella, sino que son las costumbres, y lo entiendo, pero tienen que cambiar. Aunque sí hablé con los entrenadores y les dije que es algo que debe modificarse”, cuenta Karla Moreno.

Estas anécdotas, han hecho que Romina se prepare para comentarios y hechos que enfrentará, asegura su madre. Considera que el hecho de que Romina esté jugando con niños le servirá porque está viendo que eso no quiere decir que no pueda jugar.

“Sí se va a ensuciar, se va a pegar porque ha recibido muchos bolazos, pero no importa, no es que como se pegó ya no vaya a jugar porque es niña”, dice su mamá.

“Ahora la situación está bastante complicada y es bueno el hecho de que sepa que no se puede dejar, que tiene las mismas posibilidades y derechos”, comenta Karla Moreno.
 Kelly Jones fue entrenadora en los cursos de verano de la Liga Olmeca. Vio a Romina cuando era muy pequeña y estaba aprendiendo a jugar beisbol.

Kelly empezó a jugar porque su abuela también lo hacía, pero en esa época no era bien visto, incluso cuenta que tuvo que disfrazarse de niño para que la dejaran participar.

Dice que tiene amigas quienes no han podido jugar beisbol porque no se los permiten, sólo han podido formar equipos con mujeres.

Comenta que gran parte de esta formación viene desde los padres, quienes piensan que la fuerza de las mujeres no es la misma que la de los hombres y no permitían que jugaran.

Jones considera que al entrenar con niños más pequeños puede romperse la barrera de diferencias que existe y mostrar que todos son iguales y tienen las mismas capacidades.

Mariana Martínez, quien es locutora de deportes, considera que la participación de las mujeres en este ámbito se queda de forma superficial e invita a cuestionarse si las empresas están de verdad incluyendo a las mujeres o sólo lo hacen para cumplir y encasillarlas en determinadas áreas.

“Observo que predomina una mayor confianza hacia las voces de los hombres. Por ejemplo, si una mujer comentarista, analista o narradora de cualquier deporte emite una opinión es 10 veces más cuestionada que un hombre”, añade.

Asegura que le gustaría “ver un reconocimiento de igual valor en este deporte y la inclusión a las mujeres en actividades que realmente tengan un enfoque deportivo”.

Invita a los hombres y mujeres a ser más conscientes de las opiniones que se hacen por cultura, tradición, costumbre o porque así fue siempre. “Me gustaría ver que las mujeres no sean cuestionadas al estar en una posición importante, en el sentido de que antes sólo lo hacían los hombres”, dice Mariana.

Los primeros triunfos

El equipo favorito de Romina es Texas Rangers, porque “cuando fui a su estadio pude ver las áreas de bateo y el dugout”, cuenta.

Al preguntarle cómo conseguirá la beca universitaria, responde: “Me preparo entrenando todos los días para dar lo mejor de mí en los partidos”.

Este fin de semana le entregarán un reconocimiento en la Liga Maya por ser la jugadora que más carreras hizo en el último torneo. La entrega del premio es por parte de la Asociación de Ligas Infantiles y Juveniles de Beisbol de la República Mexicana, A.C.

La Liga Maya tiene a 70 niñas inscritas para jugar softbol, aproximadamente, juegan y entrenan todos los días y en fines de semana. Las reciben desde los tres hasta los 18 años.

Después de un tiempo de práctica pueden inscribirse en cursos de verano o participar para que les sea asignado un equipo, en el cual tienen la oportunidad de ir a torneos nacionales y distritales.

Para su madre, uno de los torneos que más disfrutó fue el de Nuevo Laredo donde representó a México.

Romina considera que jugar beisbol abre las puertas para conocer este deporte y a las niñas que quieren jugar, les comenta: “No tengan miedo a hacer algo diferente a lo que siempre han hecho”.
 
","Romina, lista para jugar beisbol profesional",https://www.eluniversal.com.mx/opinion/romina-lista-para-jugar-beisbol-profesional
